{
  "schema_version": 1,
  "contract_id": "val02b-acceptance-v1",
  "prototype": "payload",
  "generated_at": "2026-07-14T09:23:29.668629Z",
  "generated_by": {
    "runner": "vitest-payload-val02b-runner",
    "command": "python spikes/val02_payload/scripts/run_val02b_acceptance.py",
    "source_digest": "6a52338786b26f4c7ce628b7c7a0c8338e5475ae31a9d96880bdc23ea9d3d990",
    "source_files": [
      "spikes/val02_contract/fixtures/domain_fixture.json",
      "spikes/val02_contract/python_candidate_client/client.py",
      "spikes/val02_contract/val02b_acceptance_contract.json",
      "spikes/val02_contract/val02b_acceptance_result.py",
      "spikes/val02_payload/.env.example",
      "spikes/val02_payload/README.md",
      "spikes/val02_payload/eslint.config.mjs",
      "spikes/val02_payload/next.config.mjs",
      "spikes/val02_payload/package-lock.json",
      "spikes/val02_payload/package.json",
      "spikes/val02_payload/scripts/export.ts",
      "spikes/val02_payload/scripts/live_python_client_smoke.py",
      "spikes/val02_payload/scripts/provision-browser-fixture.ts",
      "spikes/val02_payload/scripts/provision-client.ts",
      "spikes/val02_payload/scripts/run_acceptance.py",
      "spikes/val02_payload/scripts/run_val02b_acceptance.py",
      "spikes/val02_payload/scripts/seed.ts",
      "spikes/val02_payload/src/app/(frontend)/characters/[id]/page.tsx",
      "spikes/val02_payload/src/app/(frontend)/layout.tsx",
      "spikes/val02_payload/src/app/(frontend)/page.tsx",
      "spikes/val02_payload/src/app/(frontend)/search/page.tsx",
      "spikes/val02_payload/src/app/(frontend)/styles.css",
      "spikes/val02_payload/src/app/(payload)/admin/[[...segments]]/page.tsx",
      "spikes/val02_payload/src/app/(payload)/admin/importMap.js",
      "spikes/val02_payload/src/app/(payload)/api/[...slug]/route.ts",
      "spikes/val02_payload/src/app/(payload)/api/graphql-playground/route.ts",
      "spikes/val02_payload/src/app/(payload)/api/graphql/route.ts",
      "spikes/val02_payload/src/app/(payload)/layout.tsx",
      "spikes/val02_payload/src/app/health/route.ts",
      "spikes/val02_payload/src/collections/CandidateRecords.ts",
      "spikes/val02_payload/src/collections/Characters.ts",
      "spikes/val02_payload/src/collections/FigurePrototypes.ts",
      "spikes/val02_payload/src/collections/FigureVersions.ts",
      "spikes/val02_payload/src/collections/Manufacturers.ts",
      "spikes/val02_payload/src/collections/Media.ts",
      "spikes/val02_payload/src/collections/OperationLogs.ts",
      "spikes/val02_payload/src/collections/ReviewWorkItems.ts",
      "spikes/val02_payload/src/collections/SourceRecords.ts",
      "spikes/val02_payload/src/collections/Users.ts",
      "spikes/val02_payload/src/collections/Works.ts",
      "spikes/val02_payload/src/components/admin/CandidateReviewClient.tsx",
      "spikes/val02_payload/src/components/admin/CandidateReviewView.tsx",
      "spikes/val02_payload/src/components/admin/DomainOperationsClient.tsx",
      "spikes/val02_payload/src/components/admin/DomainOperationsView.tsx",
      "spikes/val02_payload/src/components/frontend/GalleryGrid.tsx",
      "spikes/val02_payload/src/databaseRuntime.ts",
      "spikes/val02_payload/src/domain/export.ts",
      "spikes/val02_payload/src/domain/fixture.ts",
      "spikes/val02_payload/src/domain/payloadDomainService.ts",
      "spikes/val02_payload/src/domain/seed.ts",
      "spikes/val02_payload/src/domain/sourceKey.ts",
      "spikes/val02_payload/src/domain/val02bDomainService.ts",
      "spikes/val02_payload/src/endpoints/adminDomain.ts",
      "spikes/val02_payload/src/endpoints/candidateMediaUpload.ts",
      "spikes/val02_payload/src/endpoints/candidateReview.ts",
      "spikes/val02_payload/src/endpoints/candidateUpsert.ts",
      "spikes/val02_payload/src/globals/SystemSettings.ts",
      "spikes/val02_payload/src/hooks/candidateMediaBoundary.ts",
      "spikes/val02_payload/src/hooks/protectMainImage.ts",
      "spikes/val02_payload/src/hooks/sourceBoundary.ts",
      "spikes/val02_payload/src/lib/gallery.ts",
      "spikes/val02_payload/src/migrations-postgres/index.ts",
      "spikes/val02_payload/src/migrations/20260713_190619_val02_initial_schema.json",
      "spikes/val02_payload/src/migrations/20260713_190619_val02_initial_schema.ts",
      "spikes/val02_payload/src/migrations/20260714_044222_val02b_decision_gates.json",
      "spikes/val02_payload/src/migrations/20260714_044222_val02b_decision_gates.ts",
      "spikes/val02_payload/src/migrations/index.ts",
      "spikes/val02_payload/src/payload-types.ts",
      "spikes/val02_payload/src/payload.config.ts",
      "spikes/val02_payload/src/security/networkGuard.ts",
      "spikes/val02_payload/src/security/roles.ts",
      "spikes/val02_payload/tests/configuration.test.ts",
      "spikes/val02_payload/tests/integration.test.ts",
      "spikes/val02_payload/tests/security.test.ts",
      "spikes/val02_payload/tests/ui.test.tsx",
      "spikes/val02_payload/tsconfig.json",
      "spikes/val02_payload/vitest.config.ts"
    ]
  },
  "fixture_sha256": "9a55a00d0290281b6ca6b2a2e7041c2f858e256e77303431ee551de89132440b",
  "assertions": [
    {
      "id": "BG-01",
      "status": "pass",
      "evidence": [
        {
          "kind": "browser_test",
          "reference": "spikes/val02b_infra/tests/browser-gates.spec.ts::BG-01 real Chrome administrator login",
          "observed": "{\"playwright_status\":\"passed\",\"duration_ms\":1582,\"clicks\":1,\"console_error_count\":0,\"forbidden_request_count\":0,\"hpoi_request_attempt_count\":0,\"main_frame_navigations\":3,\"network_failure_count\":0}"
        }
      ]
    },
    {
      "id": "BG-02",
      "status": "pass",
      "evidence": [
        {
          "kind": "browser_test",
          "reference": "spikes/val02b_infra/tests/browser-gates.spec.ts::BG-02 complete candidate review through the real browser",
          "observed": "{\"playwright_status\":\"passed\",\"duration_ms\":1560,\"clicks\":6,\"console_error_count\":0,\"forbidden_request_count\":0,\"hpoi_request_attempt_count\":0,\"main_frame_navigations\":5,\"network_failure_count\":0}"
        }
      ]
    },
    {
      "id": "BG-03",
      "status": "pass",
      "evidence": [
        {
          "kind": "browser_test",
          "reference": "spikes/val02b_infra/tests/browser-gates.spec.ts::BG-03/BG-04 public search, gallery, lightbox and responsive layout",
          "observed": "{\"playwright_status\":\"passed\",\"duration_ms\":4189,\"clicks\":15,\"console_error_count\":0,\"forbidden_request_count\":0,\"hpoi_request_attempt_count\":0,\"keyboard_actions\":1,\"main_frame_navigations\":22,\"network_failure_count\":9,\"interaction\":\"lightbox/zoom/previous/next/close\"}"
        }
      ]
    },
    {
      "id": "BG-04",
      "status": "pass",
      "evidence": [
        {
          "kind": "browser_test",
          "reference": "spikes/val02b_infra/tests/browser-gates.spec.ts::BG-03/BG-04 public search, gallery, lightbox and responsive layout",
          "observed": "{\"playwright_status\":\"passed\",\"duration_ms\":4189,\"clicks\":15,\"console_error_count\":0,\"forbidden_request_count\":0,\"hpoi_request_attempt_count\":0,\"keyboard_actions\":1,\"main_frame_navigations\":22,\"network_failure_count\":9,\"responsive_layout\":\"computed 4/3/2 columns and contain geometry\"}"
        }
      ]
    },
    {
      "id": "BG-05",
      "status": "pass",
      "evidence": [
        {
          "kind": "file_upload_test",
          "reference": "scripts/live_python_client_smoke.py over a real loopback Next/Payload server",
          "observed": "Shared CandidateClient created a multipart media record, then a renamed identical upload reused media identity=True."
        }
      ]
    },
    {
      "id": "BG-06",
      "status": "pass",
      "evidence": [
        {
          "kind": "file_upload_test",
          "reference": "closes the synthetic multipart candidate-media loop",
          "observed": "Server decoded PNG bytes and verified SHA-256, 64-bit aHash, MIME type, dimensions and byte size."
        }
      ]
    },
    {
      "id": "BG-07",
      "status": "pass",
      "evidence": [
        {
          "kind": "file_upload_test",
          "reference": "closes the synthetic multipart candidate-media loop",
          "observed": "Renamed identical bytes reused one media ID; changed bytes under a reused idempotency key returned HTTP 409."
        }
      ]
    },
    {
      "id": "BG-08",
      "status": "pass",
      "evidence": [
        {
          "kind": "file_upload_test",
          "reference": "closes the synthetic multipart candidate-media loop",
          "observed": "Text, MIME mismatch and oversize payloads were rejected before formal mutation; a valid retry created candidate-only media."
        }
      ]
    },
    {
      "id": "BG-09",
      "status": "pass",
      "evidence": [
        {
          "kind": "auth_test",
          "reference": "enforces current per-client identity, owner isolation, revocation and formal-data boundaries",
          "observed": "Client B could neither upsert client A's source/candidate nor upload media into A's candidate."
        }
      ]
    },
    {
      "id": "BG-10",
      "status": "pass",
      "evidence": [
        {
          "kind": "auth_test",
          "reference": "enforces current per-client identity, owner isolation, revocation and formal-data boundaries",
          "observed": "Hash-only runtime credential authenticated before revocation and returned HTTP 403 after server-side disable."
        }
      ]
    },
    {
      "id": "BG-11",
      "status": "pass",
      "evidence": [
        {
          "kind": "api_permission_test",
          "reference": "enforces current per-client identity, owner isolation, revocation and formal-data boundaries",